id_palabra,Palabra,id_cronista,id_texto,cita,pagina
120105,Citua,12,T12162,"""La razón porque acían esta fiesta llamada Citua en este mes, es porque entonces començauan las aguas y con las primeras aguas suele aver muchas enfermedades, para rogar al Hacedor que el aquel año, así en el Cuzco como en todo lo conquistado del Ynca, tuviese por bien no las ubiese...""",73
120105,Citua,12,T12163,"""Y así acordado lo que avían de hazer, el sacerdote mayor del Sol y el Ynca salían todos, y el sacerdote mayor decía a las jentes que estavan juntos, como el Hacedor tenía por bien se hiziese la dicha citua o fiesta, y que se hechasen todas las enfermedades y males de la tierra,...""",73
120105,Citua,12,T12164,"""Asimismo, en todas las caveças de provincias, hacían la dicha fiesta o pascua, llamada Citua, todos los yngas governadores""",96
120106,çitua,12,T12165,"""El primero día desta fiesta llamada çitua hera quando comían el sanco dicho yaguarçanco; el segundo día dedicavan al Acedor, Sol y Trueno, haciendo por él sacrificios y la oración que arriva está dicha por el Ynca.""",93-94
120107,Coca,12,T12166,"""Avía otros que llamavan uiropiricoc, los quales quemavan en el fuego sevo de carneros y coca, y en ciertas aguas y señales que hacían al tiempo del quemar, vían lo que avía de suceder y al que los concultava se lo decían.",63
120107,Coca,12,T12167,"""…y al entrar del Sol llevavan otro al cerro llamado Aepiran, porque sobre él se pone el Sol, el qual sacrificavan por la misma horden; y sacrificavan demás desto y ofrecían a las dichas huacas unos cesticos de coca llamados paucarunco y unos que llamavan paucarquinto a manera de coca, y un poco de maíz tostado y conchas de la mar que llaman mullo, colorado y amarillo, hechas a manera de maíz.""",68
120107,Coca,12,T12168,"""No comían en este tiempo más de maíz cocido y yervas, y así no vevían chicha sino turvia, que llaman concho ni usavan coca en este tiempo.""",72
120107,Coca,12,T12169,"""Y allí los sacerdotes del Hacedor quemavan por la mañana un carnero blanco y maíz y coca y plumas de pájaros de colores de mullo, que es concha de la mar, como dicho está, rogando al Hacedor diese buen año, pues que de nada avía criado todas las cosas y dádoles ser, tuviese por bien de dales buen año.""",72
120107,Coca,12,T12170,"""Y así para este día tenían aparejado todos los géneros y maneras de comidas que ellos usavan, todas las maneras de ajíes, gran cantidad de cestos de coca, todas las maneras de ropas de colores que ellos uestían, y calçados de que usavan, llautos y plumas que se ponían en la caveça""",115
120107,Coca,12,T12171,"""y alumbrando los que lo yban siguiendo y llegados a la puente del dicho Allonsaytambo [Ollantaytambo], que es un río grande que baxa la mar del norte, al llegar de los dichos sacrificios hechavan de la puente dos cestos de coca llamados pilco longo, paucarongo y así dejavan yr solos a los dichos sacrificios.""",116
120107,Coca,12,T12172,"""y les deçía: Vosotros tomad cada uno su parte de essa ofrendas y sacrificios, y llevadla a la principal huaca vuestra, y allí las sacrificas; y tomádolas, llevavan hasta la guaca, y allí ahogavan a los niños y los enterravan juntamente con las figuras de plata, de ovejas y de personas de oro y plata; y las ovejas y carneros y ropas lo quemavan, y tanbién unos cestillos de coca.""",122
120108,Chochilliquilla,12,T12173,"""Y mucha cantidad de donzellas que para servir en la dicha fiesta heran deputadas y escoxidas, salían este dicho día a la plaza vestidas de unos uestidos que llaman cuzco axo y chochilliquilla, que eran de hedad de honce y doze años y catorce años.""",100
120109,Coco,12,T12174,"""Llamavan al mes de diciembre Camayquilla, en el qual, el primer día de la luna, los que se avían armado cavalleros, así de la parcialidad de Anan Cuzco como de Hurin Cuzco, salían a la plaza con unas hondas en las manos, llamadas huaracas, y los de Anan Cuzco contra los de Hurin Cuzco se tiravan hondaces con una que llaman coco, que se da en unos cordones, y benían algunas vezes a los braços a provar las fuerças, hasta que el Ynga que estava ya en la plaza se levantava y los ponían en paz. Llamauan a esto chocanaco; hacían esto para que fuesen conocidos los de más fuerças y más baliente""",111
120110,Coies,12,T12175,"""con livertad usavan sus oficios bolviendo a ellos y no quitando del lado de los yndios echos guacas, receviendo los carneros y coies para los sacrificios.""",131-132
120111,Colcapata,12,T12176,"""Sacavan a esta fiesta las dos figuras de muger llamadas palpasillo e ynca oillo con ropas muy ricas cuviertas con chapería de oro, llamadas llancapata, colcapata y paucaronco.""",70
120112,Collado,12,T12177,"""y que en Pucara, que es quarenta leguas de la ciudad del Cuzco por el camino del Collado…""",53
120113,Collasuyo,12,T12178,"""Y en la plaza en medio della, ado estava el usno de oro, que hera a manera de pila, adonde hechavan el sacrificio de la chicha, quando vevían hallavan que estavan a punto de guerra quatrocientos yndios alrededor de la dicha pila, bueltos los ciento el rostro a Collasuyo que está al nacimiento del Sol y otros cientos bueltos los rostros al poniente, que es el camino de Chinchaysuyo y otros ciento el rostro al cententrión, que es el camino de Antisuyo y ciento los rostros al mediodía, y tenían todos los generos de armas y que ellos usavan.""",74
120113,Collasuyo,12,T12179,"""Y salían todos quatro esquadrones, cada uno para el lugar que estaba dedicado, saliendo los que estaban para Collasuyo con gran ynpetu hasta la angostura de acoyapongo, que será dos leguas del Cuzco pequeñas e yban dando boces diciendo: Salga el mal fuera.""",74
120113,Collasuyo,12,T12180,"""Heran estos yndios que llevavan estas boces hacia Collasuyo, los que salían del Cuzco de la generación de Uscaymataayllo, Yapo may ho ayllo, Yahuaymin ayllu y Sutic y Marasaylla, Cuycussa ayllo.",74-75
120113,Collasuyo,12,T12181,"""Y otro día siguiente, por la misma horden, salían a la misma plaza y puestos por su horden ls huacas y el Unca y demás jente, trayan a la plaza grandésima cantidad de ganado de todo género de todas las quatro partidas llamadas Collasuyo y Chinchaysuyo y Antisuyo y Contisuyo.""",79
120113,Collasuyo,12,T12182,"""La Capacocha yventó también Pachacuti Ynga Yupanqui, la qual hera desta manera: las provincias de Collasuyo y Chinchausuyo y Antisuyo y Contisuyo trayan a esta ciudad, de cada puelo y generación de jentes, uno o dos niños y niñas pequeños, y de hedad de diez años; y trayan ropa y ganado y ovejas de oro y de plata de mollo.""",120-121
120113,Collasuyo,12,T12183,"""Y davan dos bueltas, y después de acavado, el Ynga llamava a los sacerdotes de las provincias y hacía partir los dichos sacrificios en quatro partes para los quatro Suyos: Collasuyo, Chinchaysuyo, Antisuyo, Contisuyo que son las quatro partidas en questá dividida esta tierra""",121-122
120114,Collcaonco,12,T12184,"""así los padres de los que se avían de armar cavalleros como los parientes y los parientes y padres salían bestidos de una vestiduras que llaman collcaonco, y avían con que heran diferencias de vestidos que tenían, para conforme a las fiestas que hacían.""",99
120115,Colle,12,T12185,"""y los yndios le entravan a adorar con carneros, colle, chicha, llipta, mollo y otras cossas y hacían fiestas todo el pueblo de dos y tres días, baylando y beviendo, e ynbocando a la guaca que aquel representava y decía tenía en el cuerpo""",131
120116,Colliçara,12,T12186,"""dicho lo qual mandan al enfermo que le traygan maíz blanco que llaman paracayҫara, y maíz negro que llaman colliçara, y maíz entrevetado de colorado y amarillo que llaman çumaçara (…) amarillo que llaman paraçora y otras conchas de la mar que llaman ellos mollo mollo de todas las colores que pueden aver, que llaman ymaymana mollo""",132-133
120117,Collopata,12,T12187,""" Y asimismo en cada un día de los deste mes, yban a quemar a los carneros y lo demás a los lugares siguientes: a un cerro llamado Succanca y otro llamado Omoto Yanacauri y otro llamado Capac Uilca, que está a tres leguas de Huanacauri y otro llamado Queros Huanacauri y otro llamado Rontoca que está en los Quisguares y otro cerro llamado Collopata que está en Pomacanche, catorce leguas desta ciudad, y a un llano llamado Yanayana, y a otro cerro llamado Cuti que está en la puna de Pomacanche; y así caminando yban otro día a Uilcanoto que es veinte y seis leguas del Cuzco.""",68-69
120118,Colquinapa,12,T12188,"""Llaman a estas ovejas de oro y plata corinapa, colquinapa. """,70-71
120119,Conanaco,12,T12189,"""y le amonestava y aconseja de la manera que avía de vivir y obedecer a sus padres, a lo qual llamavan conanaco, y le ofrecían lo que le parecía conforme a sus posible""",120
120120,Concho,12,T12190,"""No comían en este tiempo más de maíz cocido y yervas, y así no vevían chicha sino turvia, que llaman concho ni usavan coca en este tiempo.""",72
120121,Contisuyo,12,T12191,"""Los que yban a la parte de Contisuyo heran de las generaciones siguientes: Raurapanaca aillu y Chinapanaca aillu y Mascapanaca aillu y Quesco ayllu, y éstos las allegavan a Churicalla, que es dos leguas del Cuzco, y allí las entregavan a los de Tantar, que es quatro leguas del Cuzco y aquéllos las llevavan al río de Cusibamba, que es adonde los frailes de la Merced tienen una viña, que es siete leguas del Cuzco; y allí se bañavan y lavavan las armas.""",75
120121,Contisuyo,12,T12192,"""Y otro día siguiente, por la misma horden, salían a la misma plaza y puestos por su horden ls huacas y el Unca y demás jente, trayan a la plaza grandésima cantidad de ganado de todo género de todas las quatro partidas llamadas Collasuyo y Chinchaysuyo y Antisuyo y Contisuyo.""",79
120121,Contisuyo,12,T12193,"""La Capacocha yventó también Pachacuti Ynga Yupanqui, la qual hera desta manera: las provincias de Collasuyo y Chinchausuyo y Antisuyo y Contisuyo trayan a esta ciudad, de cada puelo y generación de jentes, uno o dos niños y niñas pequeños, y de hedad de diez años; y trayan ropa y ganado y ovejas de oro y de plata de mollo.""",120-121
120121,Contisuyo,12,T12194,"""Y davan dos bueltas, y después de acavado, el Ynga llamava a los sacerdotes de las provincias y hacía partir los dichos sacrificios en quatro partes para los quatro Suyos: Collasuyo, Chinchaysuyo, Antisuyo, Contisuyo que son las quatro partidas en questá dividida esta tierra""",121-122
120122,Corinapa,12,T12195,"""Llaman a estas ovejas de oro y plata corinapa, colquinapa. """,70-71
120123,Coya,12,T12196,"""Los que llevavan las boces a la parte del Antisuyo heran de las generaciones siguientes: Cuscupanaca ayllo, Aucaylli ayllo, Tarpuntai aillu, Sano aillu; y éstos las llevavan a Chita, que es legua y media del Cuzco, y las entregavan a los metimas de Pisa, que son los de la Coya y Paulo y éstos las allegavan al río de Pisa y allí las hechavan y se bañaban y bañaban sus armas.""",75
120123,Coya,12,T12197,"""de los que avían de ser armados cavalleros, entendían en adereçar las ojotas, que era el calçado que para ello hacían, de una paja que llaman coya muy delgada, que casi parecía de color de oro, y en hacer unas guaracas de nercios de carneros, que para aquel efeto se hacían""",99
120124,Coyapacssa,12,T12198,"""Salía también la muger llamada Coyapacssa, la qual estaua sacrificada por muger del Sol y esta hera hermana, hija del que governava.""",77
120125,Coyaraymi,12,T12199,"""Al mes de agosto llamavan Coyaraymi, y en este mes hacían la Citua, y para hacer la dicha fiesta trayan las figuras de las huacas de toda la tierra de Quito a Chile, las quales ponían en sus casas que en el Cuzco tenían para el efecto que aquí diremos después.""",73
120126,Coyo,12,T12200,"""Llamavan estas camisetas puca caycho anco; llamavan a este taqui coyo; ynventólo Pachacuti Ynca Yupanqui, y hacíase con tanbores, dos de Anan Cuzco y dos de Hurin Cuzco.""",108
120127,Cullquenapa,12,T12201,"""llevando delante el suntur paucar y dos carneros de oro el uno y el otro de plata, llamados cullquenapa, curinapa, porque heran las insinias que llevava la estatua del Sol doquiera que yba, y así se acavava esta pascua y mes llamado Capa raymi.""",110
120128,çumaçara,12,T12202,"""dicho lo qual mandan al enfermo que le traygan maíz blanco que llaman paracayçara, y maíz negro que llaman colliçara, y maíz entrevetado de colorado y amarillo que llaman çumaçara (…) amarillo que llaman paraçora y otras conchas de la mar que llaman ellos mollo mollo de todas las colores que pueden aver, que llaman ymaymana mollo""",132-133
120129,Cupaticas,12,T12203,"""A los dies y ocho días del dicho mes, salían a la plaza vestidos con unas vestiduras muy galanas llamadas anga sonco quila pionco, y unas mantas pequeñas, y en las caveças unas plumas llamadas cupaticas, quez son de colas de guacamayas y pilo llamado gualanbabi; que hera hecho de plumas.""",113-114
120130,çupay,12,T12204,""" así como tenía por entendido que avía ynfierno para los malos y que allí los atormentavan los demonios, que ellos llaman çupay.""",111-112
120131,Curacas,12,T12205,"""Y así se venían hasta una quebrada que se llama Quirasmanta, y allí los tíos y padres y curacas, con las guaracas que les avían dado, en nombre de las guacas, les açotavan en los braços y piernas""",101
120132,Curicancha,12,T12206,"""Yban a Curicancha por la mañana y a mediodía y a la noche llevando los carneros que se avían de sacrificar aquel día, los quales trayan alrededor de los ydolos y huacas llamadas Punchao ynca, que era el Sol y Pachayachachi que era otro ydolo figura de hombre, que quiere decir el dicho bocablo, Hacedor, y otro ydolo llamado Chuquiylla Yllapa que era la huaca del Relámpago y Trueno y Rayo la qual huaca hera forma de persona, aunque no le vían el rostro.""",67
120132,Curicancha,12,T12207,"""…y a mediodía, por la misma orden, quemavan otro carnero en Curicancha en el patio de la dicha Casa del Sol, que agora es claustro de los frailes del Senor Sancto Domingo..""",68
120132,Curicancha,12,T12208,"""el día de la conjunción de la Luna, a mediodía yba el Ynca con todas las personas de su consejo y los más principales yncas que se hallavan en el Cuzco a Curicancha que es a la Casa del Sol y templo adonde hacían su cavildo tratando de qué manera se haría la dicha fiesta..."".",73
120133,Curinapa,12,T12209,"""llevando delante el suntur paucar y dos carneros de oro el uno y el otro de plata, llamados cullquenapa, curinapa, porque heran las insinias que llevava la estatua del Sol doquiera que yba, y así se acavava esta pascua y mes llamado Capa raymi.""",110
120134,Cuscupanaca Ayllo,12,T12210,"""Los que llevavan las boces a la parte del Antisuyo heran de las generaciones siguientes: Cuscupanaca ayllo, Aucaylli ayllo, Tarpuntai aillu, Sano aillu; y éstos las llevavan a Chita, que es legua y media del Cuzco, y las entregavan a los metimas de Pisa, que son los de la Coya y Paulo y éstos las allegavan al río de Pisa y allí las hechavan y se bañaban y bañaban sus armas.""",75
120135,Cusibamba,12,T12211,"""Los que yban a la parte de Contisuyo heran de las generaciones siguientes: Raurapanaca aillu y Chinapanaca aillu y Mascapanaca aillu y Quesco ayllu, y éstos las allegavan a Churicalla, que es dos leguas del Cuzco, y allí las entregavan a los de Tantar, que es quatro leguas del Cuzco y aquéllos las llevavan al río de Cusibamba, que es adonde los frailes de la Merced tienen una viña, que es siete leguas del Cuzco; y allí se bañavan y lavavan las armas.""",75
120136,Cuti,12,T12212,""" Y asimismo en cada un día de los deste mes, yban a quemar a los carneros y lo demás a los lugares siguientes: a un cerro llamado Succanca y otro llamado Omoto Yanacauri y otro llamado Capac Uilca, que está a tres leguas de Huanacauri y otro llamado Queros Huanacauri y otro llamado Rontoca que está en los Quisguares y otro cerro llamado Collopata que está en Pomacanche, catorce leguas desta ciudad, y a un llano llamado Yanayana, y a otro cerro llamado Cuti que está en la puna de Pomacanche; y así caminando yban otro día a Uilcanoto que es veinte y seis leguas del Cuzco.",68-69
120137,Cuya,12,T12213,"""y los pariente les davan ojotas de una paja que entre ellos hera preciada, llamada cuya""",103
120138,Cuycussa Ayllo,12,T12214,"""Heran estos yndios que llevavan estas boces hacia Collasuyo, los que salían del Cuzco de la generación de Uscaymataayllo, Yapo may ho ayllo, Yahuaymin ayllu y Sutic y Marasaylla, Cuycussa ayllo.",74-75
120139,Cuyllo,12,T12215,"""Heran los carneros blancos y lanudos llamados cuyllo""",79
120140,Cuyllor,12,T12216,"""Sacrificavan en este mes al Sol gran cantidad de carneros de todos los colores llamados los unos huacarpana, que eran blancos y lanudos y otros carneros llamados huanacos, y otros pacos blancos lanudos llamados cuyllor y otros pacos llamados paucarpaco, que eran hembras, bermejos y lanudos y otros pacos llamados oquipaco, y otros carneros grandes llamados chumpi, que heran negros y lanudos.""",67
120141,Cuyos,12,T12217,"""y acordó con ellos que recoxiesen comida y ganado lo más que pudiesen, y suviéronse en un cerro muy alto llamado Ancasmarca; y dicen como las aguas yban creciendo y cubriendo la tierra, yba ceciendo el cerro de tal manera que jamás le sobrepujaron y que después como se yban recojiendo las aguas, se yba bajando el cerro, y así destos seis hijos de aquel pastor que allí escaparon, se bolvió a poblar la provincia de los Cuyos""",57
120142,Cuzco,12,T12218,"""Los que yban a la parte de Contisuyo heran de las generaciones siguientes: Raurapanaca aillu y Chinapanaca aillu y Mascapanaca aillu y Quesco ayllu, y éstos las allegavan a Churicalla, que es dos leguas del Cuzco, y allí las entregavan a los de Tantar, que es quatro leguas del Cuzco y aquéllos las llevavan al río de Cusibamba, que es adonde los frailes de la Merced tienen una viña, que es siete leguas del Cuzco; y allí se bañavan y lavavan las armas.""",75
120142,Cuzco,12,T12219,"""Y quando empeçava la vocería en el Cuzco salían todas las jentes de los sitios grandes como pequeños, a sus puertas, dando boces, sacudiendo las mantas y llicllas diciendo: 'vaya el mal fuera'"".",75
120142,Cuzco,12,T12220,"""Y luego, como a las ocho o nueve del día, el Ynca, señor principal, con su muger y jente cortesana de su Consejo que en su tenía, salía a la plaça principal del Cuzco lo más ricamente adereçados que podían""",77
120143,Hanan Cuzco,12,T12221,"""Y a esta ora salía toda la jente del Cuzco por sus aillos y parcialidades, los quales venían lo más ricamente adereçados que podían, y llegados mochavan al Açedor y al Sol y al Ynca señor, y luego se asentavan en sus asientos cada uno conforme a la calidad que tenían, divididos: los Hanan Cuzcos a su parte y los Hurin Cuzcos a la suya.""",78
120144,Cuzco,12,T12222,"""Y así repartido el dicho ganad, matavan en gran cantidad para comer en aquel día, y luego entrava en la plaza grandísima cantidad de chicha, la queal estava hecha de muy atrás y en las bodegas que tenían para ello dedicadas la qual se hacía de maíz blanco coxido en el valle del Cuzco.""",93
120144,Cuzco,12,T12223,"""y así los que avían de bolver a sus tierras pedían licencia al Hacedor, al Sol, al Trueno y al Ynca, los quales se la concedían con que dejasen en el Cuzco""",96
120144,Cuzco,12,T12224,"""Al mes de septiembre llamavan Omacrayma. Llamávanle así porque los yndios de Omo, que es dos leguas del Cuzco, hacían la fiesta del Guarachillo que es quando armavan cavalleros a los mançevos y les oradavan las orejas como en su lugar se dirá.""",97
120144,Cuzco,12,T12225,"""En el Cuzco, las mugeres que tenían hijos a quien obiesen de oradar las orejas y hacer Guarachico, entendían en hilar las ropas que se avían de vestir sus hijos el día de la fiesta del Guarachico.""",97
120144,Cuzco,12,T12226,"""Y en el Cuzco entendían en hacer gran cantidad de chicha para la fiesta que se avía de hacer llamada Capac Raymi; llamavan a este modo de hacer chicha: cantaray.""",97
120144,Cuzco,12,T12227,"""Acavado el dicho taqui se levantavan y venían al Cuzco, donde les salía al camino un pastor, de los que tenían a cargo cierto ganado llamado rayminapa, que para esta fiesta tenían dedicado""",102
120144,Cuzco,12,T12228,"""Venían por sus parcialidades y aillos toda la jente hasta allegar al Cuzco, trayendo los que se avían armado cavalleros, las guaracas en la caveça y los manojos de paja en las manos; y así allegados a la plaza hacían adoración a las guacas ya dichas.""",102
120144,Cuzco,12,T12229,"""Y a los catorce días del dicho mes, salían a la plaza del Cuzco Huacaypata, todos los mancevos que se avían empeçado armar cavalleros con sus padres y parientes cada uno.""",102
120144,Cuzco,12,T12230,"""Concluydo lo qual se salían de la plaza por sus parcialidades, cada uno en los de su generación, e yban a dormir a un despoblado que se llama Rauraua, que será una legua del Cuzco.""",104
120144,Cuzco,12,T12231,"""y así yban caminando hasta llegar al cerro llamado Anaguarque, que será dos leguas del Cuzco, a dar a la guaca que en lo alto del cerro estava, llamada del dicho nombre. Hera guaca de los yndios del pueblo de Choco y Cachona.""",104
120144,Cuzco,12,T12232,"""Concluydo lo qual que sería ya ora de vísperas, todos por su horden se levantavan para bolver a Cuzco, todos por su horden, trayendo por delante el suntur paucar y el carnero rayminapa, en lugar de las insinias reales.""",106
120144,Cuzco,12,T12233,"""Y así por su horden llegavan al Cuzco a la plaza llamada Haucaypata, ado estava la figura o estatua del Hacedor, Sol y Trueno y Luna, y el Ynca asentado junto a la estatua del Sol, con los de su corte""",106
120144,Cuzco,12,T12234,"""Y aquella noche se quedavan a dormir al pie del cerro en un lugar llamado Guamancancha; y a la mañana, al amanecer se levantavan y suvían al cerro llamado Yauira, como dicho es, que está media legua del Cuzco""",106
120144,Cuzco,12,T12235,"""Y después de acavado el taqui, venían por su horden caminando al Cuzco trayendo por delante a manera de bandera o guión, el suntur paucar, y el dicho carnero vestido, como dicho es.""",107
120144,Cuzco,12,T12236,"""Ynstituyó esta fiesta Manco Capac, las quales cerimonias hizo hacer a Sinchi Roca, su hijo como en la Historia de los Yncas ya dijimos; y así llegados a la plaza del Cuzco, hacían la mocha y adoración a las guacas ya dichas y a la saçón ya los sacerdotes dellas las avían sacado a la plaza""",107
120144,Cuzco,12,T12237,"""se yban a bañar a una fuente llamada Calixpuquio, que está detrás de la fortaleza del Cuzco, casi un quarto de legua, adonde se quitauan aquellas uestiduras con que se avían armado cavalleros""",109
120144,Cuzco,12,T12238,"""A los veinte y tres días del dicho mes, llevavan la estatua del Sol llamada Huayna Punchao a las casas del Sol llamadas Puquin, que abrá tres tiros de arcabuz, poco más del Cuzco.""",110
120144,Cuzco,12,T12239,"""Y aquella noche entendían en haçer el dicho bayle y taqui llamado yaguayra, por todas las calles y quadras del Cuzco desde que anochecía hasta que amanecía, y a la mañana sacavan los que a cargo tenían las guacas del Hacedor, Sol y Trueno, y los cuerpos muertos a la plaza, do los ponían en sus lugares, y el Ynga salía a ponerse en el suyo porque hera junto al Sol.""",112
120144,Cuzco,12,T12240,"""Y el día siguiente que hera a los diez y nueve del dicho mes, salían a la plaça del Cuzco llamada Haucaypata, como dicho es, el Ynca y toda la demás jente, y asimismo sacavan todas las demás guacas y los cuerpos de los muertos embalsamados, do echa la revencia acostumbrada, empeçavan a hacer el sacrificio llamado Moyucati""",114
120144,Cuzco,12,T12241,"""En el Cuzco por medio dél, pasa un río pequeño llamado Capimayo y Guacapancomayo, el qual baxa de unas quebradas que están en lo alto del Cuzco hacían en él unas represas a trechos del agua para tenerla represada, no obstante que hera ynvierno, para que con más fuerça llevase los sacrificios que en él se avían de hechar.""",115
120144,Cuzco,12,T12242,"""Estavan de la una parte y de la otra, mucha jente, al remate de la ciudad del Cuzco, en un lugar que llaman Pomapichupa, adonde hechavan los dichos sacrificios.""",115
120144,Cuzco,12,T12243,"""en echando los sacrificios en el río, el Ynca señor, que presente estava, les mandava fuesen con el dicho sacrificio hasta Ollantaytambo, que con el rodeo que llevavan, será del Cuzco diez leguas.""",115-116
120144,Cuzco,12,T12244,"""y luego, por su horden, trayan el maíz de las chácaras del Hacedor, Sol, Luna y Trueno e Ynga y Guanacauri, y de todos los señores muertos. Trayanlo en unos costales pequeños con un cantar llamado araui, con unos vestidos galanos y andavan a traer el dicho maiz toda la demás jente del Cuzco, ecepto el primer día, que lo trayan los moços armados cavalleros.""",118
120144,Cuzco,12,T12245,"""y después de estar todo junto, se asentava en la plaza de Aucaypata el Ynga, que es la plaza grande del Cuzco""",121
120144,Cuzco,12,T12246,"""La jente del Cuzco llevavan los sacrificios ya dichos hasta Sacalpina, que será una legua del Cuzco y ado los recevían los yndios de Ansa.""",122
120144,Cuzco,12,T12247,"""y así en todas las guacas principales de todas las provincias, se hacían el dicho sacrificio y ofrenda, llegando a ellos primero y luego a todas las guaquillas y adoratorios, quen toda la provincia avía dando a cada una lo que del Cuzco repartido venía para cada una""",122
